,ticker,date,neg_text,uncert_text,pos_text,price_prior,price_0,price_1,price_3,price_7,p_p_n,p_0_n,Total,Buys,Holds,Sells,Rating,Target Px,delta_0_p,delta_1_p,delta_1_0,delta_3_np,delta_7_np,delta_3_n0,delta_7_n0,an_d_p,an_d_0
0,ebay,2010-07-21,against break closed conciliation conciliations crisis cut declining delinquency deter difficult divest divestiture divestitures downturn easing erred fined forego fraud ill impair impairment impairments late lie limitation limitations litigation lose loss losses lying miss missed negative negatively poses quit restructuring sever slow slower taint worse worsen worsening,approximate approximately assume assumes assumption assumptions believe believes could depend dependent differ exposure fluctuation fluctuations intangible intangibles may predict predicted risk risks uncertain uncertainties vary varying,able achieve advances benefit easily effective enable enables enhance gain gains good improve improvement improvements innovative positive positively profitably progress satisfy stability strength strong stronger success successful successfully win,8.717402458190918,8.457432746887207,8.780299186706543,8.864160537719727,8.767719268798826,10.335929870605467,10.373666763305664,29.0,15.0,13.0,1.0,3.897,11.67,-2.98,0.72,3.82,16.6,17.89,17.03,18.32,-11.43,-11.11
1,ebay,2010-09-21,break crisis cut divest divestiture divestitures downturn easing ill late lie litigation miss resign resigning sever taint termination worse worsen worsening,assume assumes assumption assumptions could differ fluctuation fluctuations may nearly predict predicted risk risks uncertain uncertainties vary varying,able achieve benefit best better easier easily easy efficiency enable enables enhance enhancement enhancements improve improvement improvements innovation profitably satisfy stability strength success win,10.335929870605467,10.373666763305664,10.205945014953613,10.373666763305664,10.23110294342041,10.096923828125,10.310770988464355,27.0,14.0,12.0,1.0,3.926,11.08,0.37,-1.26,-1.62,-2.67,-1.31,-0.61,0.78,-8.87,-6.94
2,ebay,2010-10-05,absence against allege alleged alleging breach breached break cease ceased challenge challenges closed closing closure closures confine confined conflict contested contrary criminal cut defect defective defend defending destroy destroyed destruction deter disclose disclosed disinterested disqualification disqualified disregard disregarded erred fail fails failure fined fines force forced forego fraud harm ill illegal improper inability inadvertent incident intentional invalid invalidate lack late lie limitation limitations lose losing loss lost lying misconduct miss objecting omission penalties plea pleas pled poses posing postpone postponement prejudice question questions quit reject resign resignation resignations restate restated restatement revocation revocations revoke revoked stolen sue sued suffer suffered termination terminations threat threaten threatened unable violation volatility,appear appears believe believes could depend dependence dependent differ may might pending possible risk volatility,able advancement beneficial beneficially benefit best desired effective empower exclusive gain gains good great greater loyal opportunity pleasure satisfy succeed succeeding success win,10.096923828125,10.310770988464355,10.252068519592283,10.319157600402832,10.600092887878418,10.704919815063477,10.759429931640623,28.0,14.0,13.0,1.0,3.893,11.15,2.12,1.54,-0.57,3.74,0.99,4.27,1.5,-3.99,-3.5
3,ebay,2010-10-20,break challenge challenges closed conciliation conciliations cut delinquency deter difficult divest divestiture divestitures downturn easing erred fined forego fraud ill impair impairment impairments late lie limitation limitations litigation lose loss losses miss missed negative negatively poses quit restructuring sever taint,almost approximate approximately assume assumes assumption assumptions believe believes could depend dependent differ exposure fluctuation fluctuations intangible intangibles may predict predicted risk risks uncertain uncertainties vary varying,able achieve advances benefit easily effective enable enables enhance gain gained gains good great improve improving innovation leadership opportunities positive positively profitably progress satisfy stability stable strength strengths strong stronger success successful successfully win,10.704919815063477,10.759429931640623,11.405163764953613,11.711257934570312,12.52052116394043,12.277323722839355,12.461817741394045,29.0,15.0,13.0,1.0,3.931,11.36,0.51,6.54,6.0,4.83,-1.94,6.41,-0.47,8.08,9.7
4,ebay,2010-10-28,absence accident accidents acquiesce adverse adversely against allegation allegations allege alleged alleges alleging annul bad bankrupt bankruptcy breach breaches break calamity cancel canceled cancellation catastrophe catastrophes cease ceased ceases challenging claims closed closing closure concern concerns conciliation conflict conflicted conflicts contested contrary corrupt corruptly crisis culpability cut damage damages decline default defaulted defaulting defaults defect defend defending defer delay deliberate destroy destroyed destruction deter disclose disclosed discontinue discontinued dispose dispute disputes disqualification disregard disregarded disrupt disruption disturb disturbance disturbances divest divestiture divestitures doubt downgrading downturn easing encumbrance encumbrances enjoin enjoining erred error expose fail failed fails failure fault faulted faults fined fines force forced forego fraud fraudulent guilty harm hazard hazardous hinder idle ill illegal impair impaired impede impracticable impractical inability inadequacy inadvertent inadvisable incapable incident incidents inconsistency inconsistent ineligible infringe infringement infringes injuries inquiry insolvency insolvent insufficient interfere interference interrupt interruption interruptions invalid invalidity investigate investigating investigation involuntary lapse late laundering lie limitation limitations liquidation liquidator litigant litigation lose losing loss losses lost lying malfunction malfunctions manipulation misconduct mislead misleading misrepresent misrepresentation miss moratorium negligence negligent noncompliance nonperformance objecting objection omission omissions omit omits omitted overdue penalties penalty plaintiff plea plead pleaded pled poses postpone preclude prejudice prejudiced preventing prosecute prosecuted purport question quit refusal refuse refused reparation resign resignation resigned resigns revocation revoke sever solvency stolen stoppage stoppages strain straining sue sued sues suffer suffered suing suspend suspended suspending suspension taint terminate terminated termination terminations threat threaten threatened threatening unable unavailable unaware unfavorable unfunded unlawful unpaid unreasonable unreasonably unsold unwilling usury violate violates violation violations weak weakness worse worsen worsening,ambiguity anticipation appear appearing assume assumed assumes assuming assumption assumptions believe believed believes believing conditional conditionally contingency contingent could depend dependent differ doubt fluctuation fluctuations intangible may might nonassessable pending possible predict predicted preliminary risk risks uncertain uncertainties variable variation variations vary varying,able achieve adequately advances advantage assure assured beneficial benefit best conclusive conclusively confident constructive effective empower empowered enable enabling exclusive exclusively favorable gain gains good great greater highest improve improvement improvements improving invent invention inventions leading opportunity profitably progress satisfaction satisfactory satisfied satisfies satisfy stability stabilization succeed succeeding success win,12.277323722839355,12.461817741394045,12.52052116394043,12.608575820922852,12.931443214416506,12.348605155944824,12.201848030090332,29.0,15.0,13.0,1.0,3.931,12.48,1.5,1.98,0.47,-2.06,-4.51,-3.23,-5.64,-1.05,-2.23
5,ebay,2011-01-19,break closed conciliation conciliations cut delinquency deter difficult dispose divest divestiture divestitures downturn easing erred fined forego fraud ill impair impairment impairments late lie limitation limitations litigation lose loss losses miss missed negative negatively poses quit restructuring sever sue sued taint,approximate approximately assume assumes assumption assumptions believe believes could depend dependent differ exposure fluctuation fluctuations intangible intangibles may nearly predict predicted risk risks uncertain uncertainties vary varying,able achieve benefit easily effective enable enables enabling enhance gain gains good great greater improve improved innovate innovating innovation leadership profitably satisfy stability strength strengthen strengthening strong stronger success successful successfully win,12.348605155944824,12.201848030090332,12.90628433227539,12.793071746826172,12.709209442138672,12.201848030090332,12.90628433227539,31.0,13.0,17.0,1.0,3.742,13.13,-1.19,4.52,5.77,-4.62,-3.99,0.88,1.55,-7.07,-1.7
6,ebay,2011-01-20,break closed conciliation conciliations corrected cut delinquency deter difficult dispose divest divestiture divestitures downturn easing erred error fined forego fraud ill impair impairment impairments late lie limitation limitations litigation lose loss losses miss missed negative negatively poses quit restructuring sever sue sued taint,approximate approximately assume assumes assumption assumptions believe believes could depend dependent differ exposure fluctuation fluctuations intangible intangibles may nearly predict predicted risk risks uncertain uncertainties vary varying,able achieve benefit easily effective enable enables enabling enhance gain gains good great greater improve improved innovate innovating innovation leadership profitably satisfy stability strength strengthen strengthening strong stronger success successful successfully win,12.201848030090332,12.90628433227539,12.587610244750975,12.960794448852539,12.730175018310547,13.292047500610352,12.721789360046387,31.0,13.0,17.0,1.0,3.742,13.87,5.77,3.16,-2.47,2.56,4.41,-1.84,-0.07,-4.17,-8.28
7,ebay,2011-03-28,break closed closing closure cut difficult disclose disclosed divest divested divestiture divestitures downturn easing ill late lie litigation lose loses losing miss negative sue sued taint unanticipated,anticipate anticipated approximate approximately assume assumes assuming assumption assumptions believe believes could differ fluctuation fluctuations may possibility possible predict predicted risk risks uncertain uncertainties unknown vary varying,able achieve benefit creative easily enable enables enhance enhances innovation innovative leading profitably satisfy stability strength strengthen strengths superior win,13.292047500610352,12.721789360046387,13.032075881958008,13.015304565429688,13.354944229125975,13.032075881958008,13.2626953125,28.0,10.0,17.0,1.0,3.643,14.75,-4.29,-1.96,2.44,0.13,-2.42,1.9,-0.69,-11.65,-10.08
8,ebay,2011-03-30,absence adverse adversely against allegation allegations allege alleged alleges alleging antitrust arrears bankrupt bankruptcy breach breached breaches break burden cancel canceled cancellation cancelled caution cautioned cease challenge challenged challenges challenging claims closed closing closure closures complain complaint complaints concern conflict conflicts contested contrary criminal cut damage damages default defeat defect defects defend defended defer deficiencies deficiency delay delaying delist delisting denies deny destroy destroyed destruction deter detract disaster disasters disclaim disclaimer disclose disclosed disclosing discontinue discourage disfavor disfavoring dispose disproportion disproportionate dispute disqualification disregard disregarded disrupt disruption disruptions dissent dissenter dissenters dissolution divest divested doubt easing encroach encroachment encumber encumbers encumbrance encumbrances enjoin enjoining erred erring error fail failed fails failure failures fault fictitious fined force forced foreclosure forego forfeit forfeiture fraud grievance harass harassment hardship harm hazard hazardous ill illegal impair impede imperfection inaccuracies inaccuracy inaccurate inconsistent infringe infringed infringement infringing injunction inquiry insolvency intentional interfere interference interfering interrupt interruption invalid investigation involuntarily irreparable jeopardize lapse lapsed lapses late layoff lie limitation liquidation litigation lockout lose loses losing loss lost lying misappropriate misappropriated misappropriating misappropriation mislead misleading miss moratorium nondisclosure offend offending omission omissions omit omitted opposition overdue penalty picket picketing pled poses posing postpone postponement postponements preclude prejudice pressing preventing problem prosecution purport purported purporting purports question questioning quit redact redacted refusal reject rejection reparation resign resignation restate restated retaliation revocation revoke revoked sabotage sever slow slowdown solvency standstill stolen stoppage strain straining sue sued sues suing summons suspect suspected suspend suspension taint terminate terminated terminates terminating termination threat threaten threatened unauthorized undisclosed undue unemployment unfair unintentional unlawful unreasonably unresolved unrest unsatisfied violate violated violating violation violations weak weakness weaknesses,ambiguities ambiguity apparent appear appears approximate approximately assume assumed assuming assumption assumptions believe believes conditional conditionally contingent could depend dependence dependent differ doubt exposure likelihood may might nonassessable pending possible predict prediction predictions predictive preliminary presumption reexamination revise risk risks tending uncertain uncertainties unknown variance variant variation variations,able achieve advancement advances advantage advantageous beneficial beneficially benefit best collaboration confident desirable effective empower empowered enable exclusive exclusively favorable favoring gain gaining gains good great greater invent invention inventions inventor inventors leading opportunity perfect perfected resolve satisfaction satisfactory satisfied satisfy satisfying succeed success successful successfully win,13.032075881958008,13.2626953125,13.015304565429688,13.162062644958494,13.057235717773438,13.870691299438475,14.269033432006836,28.0,10.0,17.0,1.0,3.643,14.75,1.77,-0.13,-1.87,5.38,6.23,8.41,9.28,-5.96,-3.26
9,ebay,2011-04-27,against break closed conciliation conciliations cut delinquency deter difficult divest divestiture divestitures downturn easing erred error fined forego fraud ill impair impairment impairments late lie limitation limitations litigation lose loss losses lying miss missed negative negatively poses quit restate restated restructuring sever sharply taint weak weakness,approximate approximately assume assumes assumption assumptions believe believes could depend dependent differ exposure fluctuation fluctuations intangible intangibles may predict predicted risk risks uncertain uncertainties vary varying,able achieve benefit easily effective enable enables enhance gain gains good great greater improve improved innovation leadership positive positively profitably progress satisfy stability strength strong stronger success successful successfully win,13.870691299438475,14.269033432006836,14.256454467773438,14.105504035949707,13.719740867614744,12.56245231628418,12.52052116394043,27.0,10.0,16.0,1.0,3.667,15.29,2.87,2.78,-0.09,-10.94,-8.44,-11.24,-8.74,-17.84,-18.11
10,ebay,2011-06-13,break burden claims closing closure closures complain complained cut defend defendant defendants denied deny difficult dismiss dismissal dismissed distract distraction divest divestiture divestitures downturn easing erred fined ill late lie litigation lose losing miss missed plaintiff plea pleas poses prejudice quit taint wrong wrongdoing,assume assumes assumption assumptions believe believes could differ fluctuation fluctuations may pending possibility predict predicted risk risks uncertain uncertainties uncertainty vary varying,able achieve beneficial benefit creative easily effective enable enables innovative leading profitably satisfy stability success win,12.56245231628418,12.52052116394043,12.478590965270994,11.937685012817385,12.30667495727539,12.088635444641113,12.084442138671875,25.0,12.0,12.0,1.0,3.88,15.96,-0.33,-0.67,-0.33,1.26,-1.77,1.23,-1.81,-24.26,-24.28
11,ebay,2011-06-20,break claims closed cut difficult disclose disclosed divest divestiture divestitures downturn easing forfeit forfeiture ill late lie litigation lose miss quit sue sued taint,approximate approximately assume assumes assumption assumptions could differ fluctuation fluctuations may pending possibility predict predicted risk risks uncertain uncertainties vary varying,able achieve creative easily effective enable enables innovative leading profitably satisfy stability win,12.088635444641113,12.084442138671875,12.486977577209473,12.26474380493164,12.939828872680664,12.038317680358887,12.143144607543945,25.0,12.0,12.0,1.0,3.88,16.02,-0.03,3.3,3.33,-1.85,-6.97,-0.99,-6.16,-24.85,-24.2
12,ebay,2011-06-28,absence against allege alleged alleging breach breached break cease ceased challenge challenges closed closing closure closures confine confined conflict contested contrary criminal cut defect defective defend defending destroy destroyed destruction deter disclose disclosed disinterested disqualification disqualified disregard disregarded erred fail fails failure fined fines force forced forego fraud harm ill illegal improper inability inadvertent incident intentional invalid invalidate lack late lie limitation limitations lose losing loss lost lying misconduct miss objecting omission penalties plea pleas pled poses posing postpone postponement prejudice question questions quit reject resign resignation resignations restate restated restatement revocation revocations revoke revoked stolen sue sued suffer suffered termination terminations threat threaten threatened unable violation volatility,appear appears believe believes could depend dependence dependent differ may might pending possible risk volatility,able advancement beneficial beneficially benefit best desired effective empower exclusive gain gains good great greater loyal opportunity pleasure satisfy succeed succeeding success win,12.038317680358887,12.143144607543945,12.939828872680664,13.728126525878904,13.975518226623535,14.155820846557615,13.908429145812988,25.0,12.0,12.0,1.0,3.88,16.02,0.87,7.49,6.56,3.12,1.29,1.31,-0.48,-11.64,-13.18
13,ebay,2011-07-20,break closed collapse conciliation conciliations cut delinquency deter difficult divest divested divestiture divestitures easing erred fined forego fraud ill impair impairment impairments lapse late lie limitation limitations litigation lose loss losses miss missed poses quit restructuring sever taint,approximate approximately assume assumes assumption assumptions believe believes could depend dependent differ exposure fluctuation fluctuations hidden intangible intangibles may nearly predict predicted risk risks uncertain uncertainties vary varying,able achieve benefit easily effective enable enables enhance gain gains good improve improved innovation leadership leading positive positively profitably satisfy stability stable strength strengthen strengthened strong success successful successfully surpass surpassed surpassing win,14.155820846557615,13.908429145812988,14.021641731262207,14.172593116760256,13.732320785522461,13.266889572143555,12.86016082763672,29.0,16.0,12.0,1.0,4.034,16.11,-1.75,-0.95,0.81,-6.39,-3.39,-9.26,-6.35,-17.65,-20.17
14,ebay,2011-09-29,break cut ill lie miss,depend dependent nearly,able delight delighted easily effective enable enables enabling great innovative leadership satisfy strong tremendous win,13.266889572143555,12.86016082763672,12.365378379821776,12.30667495727539,13.54363250732422,14.201944351196287,13.912622451782227,28.0,16.0,11.0,1.0,4.0710000000000015,16.94,-3.07,-6.8,-3.85,15.4,4.86,13.05,2.72,-16.16,-17.87
15,ebay,2011-10-19,against break closed collapse conciliation conciliations cut delinquency deter difficult divest divested divestiture divestitures easing erred fined forego fraud ill impair impairment lapse late lie limitation limitations litigation lose loss losses miss missed poses quit restructuring sever taint,almost approximate approximately assume assumes assumption assumptions believe believes could depend dependent differ exposure fluctuation fluctuations hidden intangible intangibles may nearly predict predicted risk risks uncertain uncertainties vary varying,able achieve benefit easily effective enable enables enabling enhance gain gains good improve improved improvement improvements innovation leadership positive positively profitably satisfy stability strength strengthen strengthened strong success successful successfully surpass surpassed win,14.201944351196287,13.912622451782227,13.480735778808596,13.572983741760256,13.941974639892578,11.837050437927244,12.436659812927244,28.0,16.0,11.0,1.0,4.0710000000000015,16.55,-2.04,-5.08,-3.1,-12.79,-15.1,-8.37,-10.8,-28.48,-24.85
16,ebay,2011-11-28,absence adverse against allege alleged arrears bankrupt bankruptcy breach breached break caution cautionary cease ceased ceases ceasing claiming claims closed closure concern conciliation conflict contested contrary counterclaim cut damage damages decline declined declines default defect defects defer delay delayed delinquent denies deter detract disadvantage disadvantageous disadvantages disapprove disavow disclose disclosed dishonor dismiss dismissed disproportion disproportionate dispute disputes disregard disregarding dissolution doubt easing encumber encumbering encumbrance encumbrances enjoin erred erring error exculpatory expose fail failed failing fails failure fault faults fined force forced forcing forego fraud fraudulent harm idle ignoring ill illegal impair impaired impairment inability inaccurate incapable incident incomplete inconsistency inconsistent incorrect indefeasibly infringe infringement infringes injunction injunctions insolvency interfere interrupt interruption invalid invalidate invalidated invalidity investigation lack lapse lapsed late laundering lie limitation limitations liquidate liquidation liquidator litigation lose losing loss losses lying malpractice misconduct mislead misleading miss missed misstate misstatement moratorium negative negligence noncompliance nonpayment objection obsolete omission omissions omit omits omitted oppose opposed overage penalties penalty pled poses postpone postponed preclude prejudice prosecute prosecuted protest punitive purport purported purportedly purporting purports question quit refusal refuse reject reparation repudiate resign resignation restate restated restructuring revoke revokes sever solvency strain subpoena sue sued sues suffer suffered suing suspend suspended terminate terminated terminates termination terminations threat threaten threatened unable unavailability unemployment unfunded unintended unlawful unpaid unreasonably unrecovered unreimbursed unsatisfied usurious violate violates violation,anticipate anticipated appear appearing approximate approximately arbitrary assume assumed assumes assuming assumption assumptions believe believed conditional conditionally contingency contingent could depend dependent differ doubt exposure fluctuating fluctuation fluctuations intangible may maybe might pending possible precaution precautionary presume presumed revise revised risk risks tending unknown variable varied,able achieve achieved adequately advances advantage advantageous advantages assuring beneficial beneficially benefit benefited best conclusive conclusively confident desirable diligent diligently effective enable enhance enhancement exclusive favorable gain gains good great greater greatest honor improve improvement improvements leading opportunity perfect perfected progress satisfaction satisfactory satisfied satisfies satisfy succeed succeeding success win,11.837050437927244,12.436659812927244,12.055089950561525,12.445046424865724,12.973374366760256,13.266889572143555,13.053041458129885,30.0,16.0,13.0,1.0,4.0,16.33,5.07,1.84,-3.07,6.6,2.26,4.89,0.61,-18.76,-20.07
17,ebay,2011-12-12,break cut ill lie miss sue,may,able satisfy win,13.266889572143555,13.053041458129885,12.931443214416506,12.41150188446045,12.721789360046387,12.876933097839355,12.843387603759766,31.0,17.0,13.0,1.0,4.032,16.26,-1.61,-2.53,-0.93,3.75,1.22,3.48,0.96,-20.81,-21.01
18,ebay,2012-01-06,break cut ill lie miss resign resigning,,able effective satisfy success win,12.876933097839355,12.843387603759766,12.793071746826172,13.216571807861328,12.801457405090332,12.801457405090332,12.721789360046387,32.0,18.0,13.0,1.0,4.063,16.25,-0.26,-0.65,-0.39,-3.14,0.0,-3.74,-0.62,-21.22,-21.71
