,ticker,date,neg_text,uncert_text,pos_text,price_prior,price_0,price_1,price_3,price_7,p_p_n,p_0_n,Total,Buys,Holds,Sells,Rating,Target Px,delta_0_p,delta_1_p,delta_1_0,delta_3_np,delta_7_np,delta_3_n0,delta_7_n0,an_d_p,an_d_0
61,ebay,2015-11-12,absence adverse against arrears bankrupt bankruptcy breach breached break bribe bribery caution cautionary cease ceased ceases claiming claims closed closure closures collapse concern conciliation conflict contested contrary corrupt corruption counterclaim cut damage damages decline declined declines default defect defects defer delay delayed delinquent denies deter detract disadvantage disadvantageous disadvantages disapprove disavow disclose disclosed dishonor dismiss dismissed dispose disproportion disproportionate dispute disputes disregard disregarding dissolution divest divestiture doubt easing embargo embargoes encumber encumbering encumbrance encumbrances enjoin erred erring error exculpatory expose fail failed failing fails failure fault faults fined force forced forcing forego fraud fraudulent harm idle ill illegal impair impaired impairment inability inaccuracy inaccurate incapable incident incomplete inconsistent incorrect indefeasibly infringe infringement infringes injunction injunctions insolvency insufficient interfere invalid invalidate invalidated invalidity investigation knowingly lapse lapsed late laundering lie limitation limitations liquidate liquidation liquidator litigation lose losing loss losses lying malpractice misconduct mislead misleading miss missed misstate misstatement moratorium negative negligence noncompliance nonpayment objection obsolete omission omissions omit omits omitted onerous oppose opposed overage penalties penalty pled poses postpone postponed preclude prejudice prosecute prosecuted protest punitive purport purported purportedly purporting purports question quit reject reparation repudiate resign resignation restate restated restructuring revoke revokes sever solvency strain subjected subpoena sue sued sues suffer suffered suing suspend suspended terminate terminated termination terminations threat threaten threatened unable unavailability unemployment unfunded unintended unlawful unpaid unreasonably unrecovered unreimbursed unsatisfied violate violates violation,anticipate anticipated appear appearing approximate approximately arbitrary assume assumed assumes assumption assumptions believe believed conditional conditionally contingency contingent could depend dependent differ differs doubt exposure fluctuating fluctuation fluctuations hidden intangible may maybe might pending possible precaution precautionary presume presumed revise revised risk risks speculative tending unknown variable varied,able achieve achieved adequately advances advantage advantageous advantages assuring beneficial beneficially benefit benefited best conclusive conclusively confident desirable diligent diligently effective enable enhance enhancement exclusive favorable gain gains good great greater greatest honor improve improvement improvements leading opportunity perfect perfected progress satisfaction satisfactory satisfied satisfies satisfy succeed succeeding success win,28.84214973449707,28.453601837158203,28.08498191833496,28.344013214111328,28.73255920410156,26.55071830749512,26.321575164794922,45.0,13.0,31.0,1.0,3.511,29.77,-1.35,-2.63,-1.3,-6.33,-7.59,-7.14,-8.39,-10.81,-11.58
62,ebay,2016-01-27,against break closed closing closure collapse conciliation conciliations crisis cut deter difficult disclosing discontinue discontinued divest divestiture divestitures downturn easing erred fined forego ill impair impairment lapse late lie limitation limitations litigation lose losing loss losses lying miss poses quit restructuring sever taint,appear appearing approximate approximately assume assumes assumption assumptions believe believes could depend dependent differ exposure fluctuation fluctuations hidden intangible may predict predicted recalculate risk risks uncertain uncertainties vary varying,able achieve achieved benefit effective empower empowering enable enabled enhance gain gains good great opportunity progress satisfy stability strength strong success successful successfully vibrant win,26.55071830749512,26.321575164794922,23.04383087158203,23.850814819335927,23.11357116699219,24.08992004394531,23.711334228515625,45.0,15.0,29.0,1.0,3.6,30.25,-0.86,-13.21,-12.45,1.0,4.22,-0.58,2.59,-20.36,-21.62
63,ebay,2016-02-29,adverse adversely against allegation allegations allege alleged alleges alleging annul arrears bankrupt bankruptcy breach breached breaches break calamity cease ceased ceases challenging claims closed closing closure concern concerns conflict conflicted conflicts contested contrary corrupt corruptly crisis culpability cut damage damages default defaulted defaulting defaults defect defend defending deter disclose disclosed dispose dispute disputes disqualification disrupt disruption dissolution divest divestiture divestitures doubt downgrade downgrading downturn easing encumbrance encumbrances erred fail failed fails failure fault faulted faults fined fines force forced forego forfeit forfeiture forfeitures fraud fraudulent guilty harm hazard hazardous idle ill impracticable impractical inability inadvisable incident incidents inconsistency ineligible infringe infringement infringes injuries insolvency insufficient intentional interfere interference invalid invalidity investigate investigating investigation lapse late laundering lie limitation limitations liquidation litigation lose losing loss losses lying manipulation mislead misleading misrepresent misrepresentation miss moratorium noncompliance objecting objection omission omissions omit omitted overdue penalties penalty plaintiff plea plead pleaded pled poses postpone prejudice prejudiced preventing purport quit refusal refuse refused reparation restate restated revocation sever solvency sue sued suing suspend suspended suspending suspension taint terminate terminated termination threat threaten threatened threatening unavailability unavailable unaware unfavorable unfunded unlawful unpaid unsold violate violates violation violations weak weakness,ambiguity anticipate anticipated appear appearing assume assumed assumes assumption assumptions conditional contingency could depend dependent differ doubt exposure fluctuation fluctuations may might pending possible predict predicted preliminary risk risks sometime sometimes uncertain uncertainties vary varying,able achieve achieved adequately assure beneficial beneficially benefit best effective enable enabling favorable gain gains good invent invention inventions leading opportunity satisfaction satisfactory satisfied satisfies satisfy stability stabilization succeed succeeding success successful successfully win,24.08992004394531,23.711334228515625,24.15965843200684,23.850814819335927,23.86077690124512,23.980329513549805,23.86077690124512,46.0,14.0,30.0,2.0,3.5,27.95,-1.57,0.29,1.89,0.54,0.5,0.04,0.0,-14.2,-14.63
64,ebay,2016-03-09,adverse adversely against allegation allegations allege alleged alleges alleging annul arrears bankrupt bankruptcy breach breached breaches break calamity cease ceased ceases challenging claims closed closing closure concern concerns conflict conflicted conflicts contested contrary corrupt corruptly crisis culpability cut damage damages default defaulted defaulting defaults defect defend defending deter disclose disclosed dispose dispute disputes disqualification disrupt disruption dissolution divest divestiture divestitures doubt downgrade downgrading downturn easing encumbrance encumbrances erred fail failed fails failure fault faulted faults fined fines force forced forego forfeit forfeiture forfeitures fraud fraudulent guilty harm hazard hazardous idle ill impracticable impractical inability inadvisable incident incidents inconsistency inconsistent ineligible infringe infringement infringes injuries insolvency insufficient intentional interfere interference invalid invalidity investigate investigating investigation lapse late laundering lie limitation limitations liquidation litigation lose losing loss losses lying manipulation mislead misleading misrepresent misrepresentation miss moratorium noncompliance objecting objection omission omissions omit omitted overdue penalties penalty plaintiff plea plead pleaded pled poses postpone prejudice prejudiced preventing purport quit refusal refuse refused reparation restate restated revocation sever solvency sue sued sues suing suspend suspended suspending suspension taint terminate terminated termination threat threaten threatened threatening unavailability unavailable unaware unfavorable unfunded unlawful unpaid unsold violate violates violation violations weak weakness,ambiguity appear appearing assume assumed assumes assuming assumption assumptions conditional contingency could depend dependent differ doubt exposure fluctuation fluctuations may might pending possible predict predicted preliminary risk risks sometime sometimes uncertain uncertainties vary varying,able achieve achieved adequately assure beneficial beneficially benefit best effective enable enabling exclusive favorable gain gains good great greater highest invent invention inventions leading opportunity satisfaction satisfactory satisfied satisfies satisfy stability stabilization succeed succeeding success successful successfully win,23.980329513549805,23.86077690124512,23.60174560546875,24.18954849243164,23.68144798278809,23.671483993530273,23.68144798278809,47.0,14.0,31.0,2.0,3.489,27.76,-0.5,-1.58,-1.09,-2.14,-0.04,-2.1,0.0,-14.73,-14.69
65,ebay,2016-03-18,absence against allege alleged alleging breach breached breaches break cancel cease ceased ceases challenge challenges closed closing closure closures collapse concern conflict contested contrary criminal cut damage damages defect defective defects defend defending deficiencies destroy destroyed destruction deter disclose disclosed disclosing disinterested disqualification disqualified disregard disregarded doubt erred fail fails failure false fined fines force forced forego fraud harm ill illegal improper inability inadvertent incident intentional invalid invalidate lack lapse late lie limitation limitations lose losing loss lost lying misconduct mislead misleading miss objecting omission omit omits oppose opposed penalties plea pleas pled poses posing postpone postponement prejudice question questions quit recall recalled reject resign resignation resignations restate restated revocation revocations revoke revoked stolen sue sued suffer suffered termination terminations threat threaten threatened unable violate violation volatility,appear appearing appears assume believe believed believes could depend dependence dependent differ doubt hidden may might pending possible risk variation variations volatility,able advancement beneficial beneficially benefit best conclusive desired effective empower exclusive gain gains good great greater highest leading loyal opportunity pleasure resolve satisfactory satisfy satisfying solves succeed succeeding success win,23.671483993530273,23.68144798278809,24.24932289123535,24.0799560546875,24.010217666625977,24.129770278930664,24.39876365661621,47.0,14.0,31.0,2.0,3.489,27.7,0.04,2.44,2.4,0.21,0.5,1.32,1.62,-12.89,-11.92
66,ebay,2016-04-26,break closed closing closure collapse conciliation conciliations crisis cut deter difficult disclosing discontinue discontinued divest divestiture divestitures downturn easing erred fined forego ill impair impairment lapse late lie limitation limitations litigation lose losing loss losses lying miss poses quit restructuring sever taint,approximate approximately assume assumes assumption assumptions believe believes could depend dependent differ exposure fluctuation fluctuations hidden intangible may predict predicted recalculate risk risks uncertain uncertainties vary varying,able achieve achieved benefit best easier easy effective empower empowering enable enabled enables enhance enhancement enhancements gain gains good great improve improved innovation innovations invent inventor opportunity progress satisfy stability stable strength strong success successful successfully vibrant win,24.129770278930664,24.39876365661621,25.175859451293945,24.3389892578125,23.72129821777344,24.39876365661621,25.175859451293945,46.0,13.0,29.0,4.0,3.37,27.52,1.11,4.34,3.18,0.25,2.86,3.44,6.13,-11.34,-8.52
67,ebay,2016-04-27,absence adverse adversely against alienation bankrupt bankruptcy break broken cancel canceled cancellation cease ceased ceases claiming clawback closing collapse concern conflict contrary cut deceased defend defer deter discontinue discontinued dispose dissolution doubt encumber encumbered encumbrance erred erring fail fails failure fined force forego forfeit forfeited forfeiture harm ill impair impairment incident inconsistent ineligible interfere interrupt interrupts involuntary lapse lapsed lapses lapsing late lie limitation limitations liquidation losing loss lying miss penalty plea pleas pled poses preclude purport purported question questions quit resign resignation restate restated restatement restructuring revocation revoke revoked sever sue sued suspend terminate terminated terminates termination terminations unable unfunded unrest violate violation,anticipation assume assumed assumption contingent could depend dependent differ doubt hidden intangible may pending revise risk unusual vary varying,able achieve achieved achieving advantage assure attain attained attainment beneficial beneficially benefit conclusive conclusively desirable effective empower empowered enhance exclusive favorable gain gains good great greater opportunity pleasure satisfaction satisfied satisfy succeed succeeds success successful superior win,24.39876365661621,25.175859451293945,24.528282165527344,24.16962242126465,23.731260299682607,24.47846603393555,24.60798263549805,46.0,13.0,29.0,4.0,3.37,27.66,3.18,0.53,-2.57,1.28,3.15,1.81,3.69,-11.5,-11.03
68,ebay,2016-06-21,break collapse cut ill lapse lie miss tense,depend dependent hidden possibilities,able effective empower empowering enable enabled exciting great greater innovative opportunity satisfy success vibrant win,24.47846603393555,24.60798263549805,24.24932289123535,23.04383087158203,23.32278823852539,26.401277542114247,26.88945007324219,45.0,12.0,30.0,3.0,3.378,27.42,0.53,-0.94,-1.46,14.57,13.2,16.69,15.29,-3.72,-1.93
69,ebay,2016-07-20,break closed closing closure collapse conciliation conciliations crisis cut deter difficult disclosing discontinue discontinued divest divestiture divestitures downturn easing erred fined forego ill impair impairment lapse late lie limitation limitations litigation lose losing loss losses lying miss opportunistic poses quit restructuring sever taint,approximate approximately assume assumes assumption assumptions believe believes could depend dependent differ exposure fluctuation fluctuations hidden intangible may predict predicted recalculate risk risks uncertain uncertainties vary varying,able achieve achieved benefit best better effective empower empowering enable enabled enhance enhanced enhancing gain gains good great improve innovation invent inventor opportunity progress satisfy stability strength strengthen strong success successful successfully vibrant win,26.401277542114247,26.88945007324219,29.818498611450195,30.565704345703125,31.04391670227051,31.522127151489247,32.398849487304695,43.0,13.0,27.0,3.0,3.442,28.45,1.85,12.94,10.89,3.13,1.54,6.0,4.36,10.8,13.88
70,ebay,2016-10-19,break closed closing closure collapse conciliation conciliations crisis cut deter difficult disclosing discontinue discontinued divest divestiture divestitures downturn easing erred fined forego ill impair impairment lapse late lie limitation limitations litigation lose losing loss losses lying miss poses quit restructuring sever taint,approximate approximately assume assumes assumption assumptions believe believes could depend dependent differ exposure fluctuation fluctuations hidden intangible may predict predicted recalculate risk risks uncertain uncertainties vary varying,able achieve achieved benefit effective empower empowering enable enabled enables enhance enhancement enhancements gain gains good great innovation invent inventor opportunity progress satisfy stability strength strong success successful successfully vibrant win,31.522127151489247,32.398849487304695,28.911888122558594,29.111143112182607,28.49345397949219,28.154720306396484,27.95546531677246,44.0,15.0,26.0,3.0,3.523,32.58,2.78,-8.28,-10.76,-3.29,-1.19,-3.97,-1.89,-13.58,-14.19
71,ebay,2016-11-03,break closure collapse cut lapse lie miss poses,assume assumes hidden may,able gain satisfy win,28.154720306396484,27.95546531677246,27.845874786376953,27.92557716369629,27.78609848022461,29.87827491760254,30.117380142211914,43.0,14.0,26.0,3.0,3.488,33.02,-0.71,-1.1,-0.39,6.99,7.53,7.85,8.39,-9.51,-8.79
72,ebay,2017-01-25,break closed closing closure collapse conciliation conciliations crisis cut defer deter difficult disclosing discontinue discontinued divest divestiture divestitures downturn easing erred fined forego ill impair impairment lapse late lie limitation limitations litigation lose losing loss losses lying miss poses quit restructuring sever taint,approximate approximately assume assumes assumption assumptions believe believes could depend dependent differ exposure fluctuation fluctuations hidden intangible may predict predicted recalculate risk risks uncertain uncertainties vary varying,able achieve achieved advancing benefit effective empower empowering enable enabled enhance gain gains good great invent inventor leading opportunity progress satisfy stability strength strong success successful successfully vibrant win,29.87827491760254,30.117380142211914,31.621755599975586,32.05015182495117,31.95052528381348,33.893260955810554,33.723892211914055,42.0,13.0,26.0,3.0,3.452,33.43,0.8,5.84,5.0,5.75,6.08,5.22,5.55,1.39,0.88
73,ebay,2017-04-19,break closed closing closure collapse conciliation conciliations crisis cut defer deter difficult disclosing divest divestiture divestitures downturn easing erred fined forego ill impair impairment lapse late lie limitation limitations litigation lose losing loss losses lying miss pled poses quit restructuring sever sue taint,approximate approximately assume assumes assumption assumptions believe believes could depend dependent differ exposure fluctuation fluctuations hidden intangible may predict predicted recalculate risk risks uncertain uncertainties vary varying,able achieve achieved advantage advantages benefit boost effective empower empowering enable enabled enhance exclusive exclusively gain gains good great invent inventor opportunities opportunity satisfy stability strength strong success successful successfully vibrant win,33.893260955810554,33.723892211914055,32.408809661865234,31.930599212646484,33.285533905029304,33.723892211914055,32.408809661865234,40.0,14.0,24.0,2.0,3.575,35.33,-0.5,-4.38,-3.9,5.62,1.32,1.5,-2.63,-4.55,-8.27
74,ebay,2017-04-20,break closure collapse crisis cut divest divestiture divestitures downturn easing lapse lie litigation miss poses taint,appear appeared appearing assume assumes assumption assumptions could differ exposure fluctuation fluctuations hidden may predict predicted risk risks uncertain uncertainties vary varying,able achieve achieved benefit satisfy stability success successful successfully win,33.723892211914055,32.408809661865234,32.060115814208984,32.68777084350586,33.185909271240234,33.70397186279297,33.73386001586914,39.0,13.0,24.0,2.0,3.5380000000000003,35.76,-3.9,-4.93,-1.08,3.11,1.56,3.2,1.65,-5.75,-5.67
75,ebay,2017-05-22,break collapse cut lapse lie miss,depend dependent hidden,able gain gains satisfy success win,33.70397186279297,33.73386001586914,34.481063842773445,35.088790893554695,34.172218322753906,35.41756057739258,35.337860107421875,36.0,13.0,22.0,1.0,3.639,35.81,0.09,2.31,2.21,0.94,3.64,0.71,3.41,-1.1,-1.32
76,ebay,2017-06-06,adverse adversely against allegation allegations allege alleged alleges alleging annul arrears bankrupt bankruptcy breach breached breaches break calamity cancel cancellation cancelled cease ceased ceases challenging claims closed closing closure concern concerns conflict conflicted conflicts contested contrary corrupt corruptly crisis culpability cut damage damages decline default defaulted defaulting defaults defect defend defending deter disclose disclosed dispose dispute disputes disqualification disrupt disruption dissolution doubt downgrade downgrading downturn easing encumbrance encumbrances erred error fail failed fails failure fault faulted faults fined fines force forced forego forfeit forfeiture forfeitures fraud fraudulent guilty harm hazard hazardous idle ill impracticable impractical inability inadvisable incident incidents inconsistency inconsistent ineligible infringe infringement infringes injuries insolvency insufficient intentional interfere interference invalid invalidity investigate investigating investigation lapse lapsed late laundering lie limitation limitations liquidation litigation lose losing loss losses lying manipulation mislead misleading misrepresent misrepresentation miss moratorium noncompliance objecting objection omission omissions omit omitted overdue penalties penalty plaintiff plea plead pleaded pled poses postpone prejudice prejudiced preventing purport quit refusal refuse refused reparation restate restated revocation sever solvency sue sued sues suing suspend suspended suspending suspension taint terminate terminated termination threat threaten threatened threatening unavailability unavailable unaware unfavorable unfunded unlawful unpaid unsold violate violates violation violations weak weakness,alteration ambiguity appear appearing appears approximate approximately assume assumed assumes assuming assumption assumptions conditional contingency could depend dependent differ doubt exposure fluctuation fluctuations may might pending possible predict predicted preliminary revise revised risk risks sometime sometimes uncertain uncertainties variation vary varying,able achieve achieved adequately assure beneficial beneficially benefit best conclusive effective enable enabling exclusive favorable gain gains good great greater highest invent invention inventions leading opportunity satisfaction satisfactory satisfied satisfies satisfy stability stabilization succeed succeeding success successful successfully win,35.41756057739258,35.337860107421875,35.636741638183594,34.80983352661133,33.963001251220696,36.94186401367188,37.04148864746094,36.0,14.0,21.0,1.0,3.694,36.29,-0.23,0.62,0.85,6.12,8.77,6.41,9.06,1.8,2.07
77,ebay,2017-07-20,break closed closing closure collapse conciliation conciliations crisis cut defer deter difficult disclosing discontinue discontinued divest divestiture divestitures downturn easing erred expose exposed fined forego ill impair impairment lapse late lie limitation limitations litigation lose losing loss losses lying miss negative negatively opportunistic poses quit restructuring sever sharply taint,approximate approximately assume assumes assumption assumptions believe believes could depend dependent differ exposure fluctuation fluctuations hidden intangible may predict predicted recalculate revise revised risk risks uncertain uncertainties vary varying,able achieve achieved benefit easier effective empower empowering enable enabled enhance enhanced gain gains good great improving invent inventor opportunity progress satisfy stability strong stronger success successful successfully vibrant win,36.94186401367188,37.04148864746094,36.47361373901367,36.1846923828125,35.59688949584961,34.650428771972656,34.112442016601555,34.0,14.0,19.0,1.0,3.735,37.23,0.27,-1.27,-1.53,-4.24,-2.66,-5.73,-4.17,-6.93,-8.37
78,ebay,2017-08-21,break collapse cut fined ill lapse lie lying miss resign resignation sever sue sued,hidden revise revised,able advantage advantages collaboration empower empowering enable enabled great leadership leading opportunity satisfy strong success tremendous vibrant win,34.650428771972656,34.112442016601555,34.68032073974609,34.750057220458984,35.557037353515625,38.39642333984375,38.10750198364258,35.0,13.0,20.0,2.0,3.6,38.14,-1.55,0.09,1.66,10.49,7.99,9.66,7.17,0.67,-0.09
79,ebay,2017-09-21,break collapse cut fined ill lapse lie lying miss,hidden revise revised,able effective satisfy success win,38.39642333984375,38.10750198364258,38.14735412597656,37.70899200439453,38.585716247558594,37.35033416748047,37.82854843139648,36.0,14.0,20.0,2.0,3.639,38.22,-0.75,-0.65,0.1,-0.95,-3.2,0.32,-1.96,-2.28,-1.02
80,ebay,2017-10-18,break closed closing closure collapse conciliation conciliations crisis cut defer deter difficult disclosing discontinue discontinued divest divestiture divestitures downturn easing erred fined forego ill impair impairment lapse late lie limitation limitations litigation lose losing loss losses lying miss poses quit restructuring sever taint,approximate approximately assume assumes assumption assumptions believe believes could depend dependent differ exposure fluctuation fluctuations hidden intangible may nearly predict predicted recalculate recalculated revise revised risk risks uncertain uncertainties vary varying,able achieve achieved benefit effective empower empowering enable enabled enhance enhancement enhancements gain gains good great opportunity satisfy stability strength strengthen strong success successful successfully vibrant win,37.35033416748047,37.82854843139648,37.15108108520508,36.69279479980469,36.66290283203125,40.24949645996094,40.42882537841797,37.0,15.0,20.0,2.0,3.676,39.31,1.28,-0.53,-1.79,9.69,9.78,10.18,10.27,2.39,2.85
