,ticker,date,neg_text,uncert_text,pos_text,price_prior,price_0,price_1,price_3,price_7,p_p_n,p_0_n,Total,Buys,Holds,Sells,Rating,Target Px,delta_0_p,delta_1_p,delta_1_0,delta_3_np,delta_7_np,delta_3_n0,delta_7_n0,an_d_p,an_d_0
19,ebay,2012-01-18,break closed collapse conciliation conciliations crisis cut delinquency deter difficult divest divested divestiture divestitures downturn easing erred fined forego fraud ill impair impairment lapse late lie limitation limitations litigation lose loss losses miss missed negative negatively poses quit restructuring sever taint,approximate approximately assume assumes assumption assumptions believe believes could depend dependent differ exposure fluctuation fluctuations hidden intangible intangibles may nearly predict predicted risk risks uncertain uncertainties vary varying,able achieve benefit easily effective enable enables enabling enhance enhancement enhancements excellent gain gains good improve improved innovation innovative leadership positive positively profitably satisfy stability stable strong stronger success successful successfully win,12.801457405090332,12.721789360046387,13.21237850189209,13.41364574432373,13.354944229125975,15.47244644165039,15.34246063232422,33.0,19.0,13.0,1.0,4.091,16.44,-0.62,3.21,3.86,15.35,15.86,14.38,14.88,-5.89,-6.68
20,ebay,2012-04-02,adverse against breach break cancel crime cut deter doubt embezzle embezzlement fail failure felony fined forfeit fraud ill impair impairment incapacity involuntarily late lie misappropriation misconduct miss poses quit revoking sever terminate terminated termination,assuming doubt may,able achieve achievement benefit confident effective excited gain gains leading satisfy tremendous win,15.47244644165039,15.34246063232422,15.359233856201172,14.9357328414917,14.99443531036377,15.12861442565918,15.040559768676758,32.0,19.0,13.0,0.0,4.188,16.82,-0.84,-0.73,0.11,1.29,0.89,0.7,0.31,-10.06,-10.58
21,ebay,2012-04-18,break closed collapse conciliation conciliations crisis cut delinquency deter difficult divest divested divestiture divestitures downturn easing erred fined forego fraud ill impair impairment lapse late lie limitation limitations litigation lose loss losses miss missed negative negatively poses quit restructuring sever taint,almost approximate approximately assume assumes assumption assumptions believe believes could depend dependent differ exposure fluctuation fluctuations hidden intangible intangibles may nearly predict predicted risk risks uncertain uncertainties vary varying,able achieve benefit better easier easily effective enable enables enabling enhance gain gains good improve improved improvement improvements innovation opportunity profitably satisfy stability strong success successful successfully surpass surpassed win,15.12861442565918,15.040559768676758,17.032268524169922,16.625541687011722,17.288047790527347,17.21257209777832,17.288047790527347,32.0,19.0,13.0,0.0,4.188,17.08,-0.58,12.58,13.24,3.53,-0.44,3.98,0.0,0.78,1.22
22,ebay,2012-04-27,absence adverse adversely against allege alleged alleging breach breached break cancel cease ceased challenge challenges closed closing closure closures conflict contested contrary criminal cut damage damages defect defective defend defending destroy destroyed destruction deter disclose disclosed disinterested disqualification disqualified disregard disregarded disrupt disruption erred fail fails failure fined fines force forced forego fraud harm ill illegal improper inability inadvertent incident inconsistent intentional invalid invalidate lack late lie limitation limitations liquidation lose losing loss lost lying misconduct miss objecting omission penalties plea pleas pled poses posing postpone postponement prejudice question questions quit reject resign resignation resignations restate restated restatement restates revocation revocations revoke revoked stolen sue sued suffer suffered termination terminations threat threaten threatened unable violation volatility,appear appears believe believed believes could depend dependence dependent differ may might pending possible risk volatility,able advancement beneficial beneficially benefit best conclusive desired effective empower exclusive favorable gain gains good great greater highest loyal opportunity pleasure satisfy succeed succeeding success win,17.21257209777832,17.288047790527347,17.199993133544922,17.258695602416992,16.85196876525879,17.199993133544922,17.086780548095707,32.0,21.0,11.0,0.0,4.313,18.29,0.44,-0.07,-0.51,-0.34,2.07,-1.0,1.39,-5.96,-6.58
23,ebay,2012-05-01,break cut ill lie miss,assume assumed,able satisfy win,17.199993133544922,17.086780548095707,17.258695602416992,16.537487030029293,17.279661178588867,16.38234519958496,16.965181350708008,32.0,21.0,11.0,0.0,4.313,18.29,-0.66,0.34,1.01,-0.94,-5.19,2.59,-1.82,-10.43,-7.24
24,ebay,2012-07-18,break closed collapse conciliation conciliations crisis cut delinquency deter difficult dispose divest divested divestiture divestitures downturn easing erred fined forego fraud ill impair impairment lapse late lie limitation limitations litigation lose loss losses miss missed negative negatively opportunistic plea pleas poses quit restructuring sever staggering taint,anticipate approximate approximately assume assumes assumption assumptions believe believes could depend dependent differ exposure fluctuation fluctuations hidden intangible intangibles may nearly predict predicted risk risks tending uncertain uncertainties vary varying,able benefit best better easily effective enable enables enabling enhance gain gains good great improve improved innovation opportunity pleased profitably satisfy stability strong strongest success successful successfully surpass surpassed win,16.38234519958496,16.965181350708008,18.428564071655273,18.55016326904297,18.961084365844727,18.428564071655273,18.80594062805176,35.0,23.0,12.0,0.0,4.314,18.97,3.56,12.49,8.63,-0.66,-2.81,1.38,-0.82,-2.85,-0.86
25,ebay,2012-07-20,break closed closing closure collapse conciliation crisis cut deter difficult disclose disclosed divest divestiture divestitures downturn easing erred fined forego ill lapse late lie limitation limitations litigation lose losing loss losses miss opportunistic opportunistically poses taint,anticipate approximate approximately assume assumed assumes assumption assumptions believe believes could depend dependent differ fluctuation fluctuations hidden intangible may nearly predict predicted revise revised risk risks uncertain uncertainties vary varying,able easily enable enables enabling enhance gain gains profitably satisfy stability strong success successful successfully win,18.428564071655273,18.80594062805176,18.55016326904297,18.10988998413086,18.575321197509766,18.55016326904297,18.248260498046875,35.0,24.0,11.0,0.0,4.371,19.65,2.05,0.66,-1.36,2.43,-0.14,0.76,-1.76,-5.6,-7.13
26,ebay,2012-07-24,adverse adversely against allegation allegations allege alleged alleges alleging annul arrears bankrupt bankruptcy breach breaches break calamity cease ceased ceases challenging claims closed closing closure concern concerns conflict conflicted conflicts contested contrary corrupt corruptly crisis culpability cut damage damages default defaulted defaulting defaults defect defend defending deter disclose disclosed dispose dispute disputes disqualification disrupt disruption divest divestiture divestitures doubt downgrading downturn easing encumbrance encumbrances erred fail failed failure fault faulted faults fined fines force forced forego fraud fraudulent guilty harm hazard hazardous idle ill impracticable impractical inability inadvisable incident incidents inconsistency ineligible infringe infringement infringes injuries insolvency insufficient interfere interference invalid invalidity investigate investigating investigation lapse late laundering lie limitation limitations litigation lose losing loss losses lying manipulation mislead misleading misrepresent misrepresentation miss moratorium noncompliance objecting objection omission omissions omit omitted overdue penalties penalty plaintiff plea plead pleaded pled poses postpone prejudice prejudiced preventing purport quit refusal refuse refused reparation revocation sever solvency sue sued sues suing suspend suspended suspending suspension taint terminate terminated termination threat threaten threatened threatening unavailable unaware unfavorable unfunded unlawful unpaid unsold violate violates violation violations weak weakness,ambiguity appear appearing assume assumed assumes assuming assumption assumptions conditional could depend dependent differ doubt fluctuation fluctuations may might nonassessable pending possible predict predicted preliminary risk risks sometime sometimes uncertain uncertainties vary varying,able adequately assure benefit best effective enable enabling exclusive favorable gain gains good great greater highest invent invention inventions leading opportunity profitably satisfaction satisfactory satisfied satisfies satisfy stability stabilization succeed succeeding success successful successfully win,18.55016326904297,18.248260498046875,18.10988998413086,18.961084365844727,18.35308837890625,20.227392196655273,20.210620880126953,35.0,24.0,11.0,0.0,4.371,19.65,-1.63,-2.37,-0.76,6.68,10.21,6.59,10.12,2.94,2.85
27,ebay,2012-10-17,break closed collapse conciliation conciliations crisis cut delinquency deter difficult dispose divest divested divestiture divestitures downturn easing erred fined forego fraud ill impair impairment lapse late lie limitation limitations litigation lose loss losses miss missed poses quit restructuring sever sue sued taint,approximate approximately assume assumes assumption assumptions believe believes could depend dependent differ exposure fluctuation fluctuations hidden intangible intangibles may nearly predict predicted recalculate risk risks uncertain uncertainties vary varying,able benefit boost easily effective enable enables enabling enhance favorable gain gains good great innovate innovative profitably satisfy stability strong success successful successfully surpass surpassed win winning,20.227392196655273,20.210620880126953,21.31339836120605,21.028270721435547,20.759912490844727,21.028270721435547,20.69282531738281,40.0,25.0,15.0,0.0,4.225,22.1,-0.08,5.37,5.46,0.0,1.29,-1.6,-0.32,-4.85,-6.37
28,ebay,2012-10-23,break cut disagree disagreement lie miss resign,,able effective satisfy win,21.028270721435547,20.69282531738281,20.495750427246094,20.759912490844727,20.638315200805664,23.904720306396484,23.523149490356445,40.0,25.0,15.0,0.0,4.225,22.77,-1.6,-2.53,-0.95,15.15,15.83,13.31,13.98,4.98,3.31
29,ebay,2013-04-17,break closed collapse conciliation conciliations crisis cut delinquency deter difficult divest divested divestiture divestitures downturn easing erred fined forego fraud ill impair impairment lapse late lie limitation limitations litigation lose loss losses miss missed poses quit restructuring sever taint,almost approximate approximately assume assumes assumption assumptions believe believes could depend dependent differ exposure fluctuation fluctuations hidden intangible intangibles may nearly predict predicted recalculate risk risks uncertain uncertainties vary varying,able benefit easier easily effective enable enabled enables enabling enhance gain gained gains good improve improvement improvements innovation leadership opportunities profitably satisfy stability strong success successful successfully surpass surpassing win,23.904720306396484,23.523149490356445,22.1478214263916,21.648845672607425,22.03041648864746,23.820858001708984,24.05986404418945,42.0,34.0,8.0,0.0,4.5710000000000015,26.8,-1.6,-7.35,-5.85,10.03,8.13,11.14,9.21,-11.12,-10.22
30,ebay,2013-07-17,break challenge closed collapse conciliation conciliations crisis cut decline declined delinquency deter difficult dispose dispute divest divested divestiture divestitures downturn easing erred fined forego fraud ill impair impairment lapse late lie limitation limitations litigation lose loss losses miss missed overage poses quit restructuring sever taint,approximate approximately assume assumes assumption assumptions believe believes could depend dependent differ fluctuation fluctuations hidden intangible intangibles may nearly predict predicted recalculate risk risks uncertain uncertainties vary varying,able benefit confident easily effective efficient enable enabled enables enhance gain gained gains good innovation innovative leadership opportunities profitably satisfy stability stable strong success successful successfully win,23.820858001708984,24.05986404418945,22.44133758544922,21.93397521972656,21.908815383911133,22.63002586364746,22.44133758544922,44.0,37.0,7.0,0.0,4.636,26.82,1.0,-5.79,-6.73,3.17,3.29,2.31,2.43,-15.62,-16.33
31,ebay,2013-10-16,break closed closing closure closures collapse conciliation conciliations crisis cut default delinquency deter difficult disclosing dispose divest divested divestiture divestitures downturn easing erred fault fined forego fraud ill impair impairment lack lackluster lapse late lie limitation limitations litigation lose losing loss losses lying miss missed poses quit restructuring sever shut shutdown taint,approximate approximately assume assumes assumption assumptions believe believes could depend dependent differ fluctuation fluctuations hidden intangible intangibles may nearly pending predict predicted recalculate risk risks uncertain uncertainties vary varying,able benefit benefited easily effective enable enabled enables enhance enhanced gain gained gains good improve innovation invent inventor leading opportunities profitably satisfy stability strength strong success successful successfully win,22.63002586364746,22.44133758544922,21.544017791748047,21.778831481933594,21.653038024902344,22.70549964904785,22.81451988220215,43.0,36.0,7.0,0.0,4.628,26.58,-0.83,-4.8,-4.0,4.25,4.86,4.76,5.36,-14.58,-14.17
32,ebay,2014-01-22,bad break breaking closed closing closure closures collapse conciliation conciliations crisis cut default delinquency deter difficult disclosing dispose disrupt disruption divest divested divestiture divestitures downturn easing erred fault fined forego fraud ill impair impairment lapse late lie limitation limitations litigation lose loses losing loss losses lying miss missed opportunistic overage poses quit restructuring sever shut shutdown taint,approximate approximately assume assumes assumption assumptions believe believes could depend dependent differ fluctuation fluctuations hidden intangible intangibles may nearly predict predicted recalculate risk risks uncertain uncertainties vary varying,able achieve achieved benefit best easily effective enable enabled enables enhance gain gained gains good great greater incredibly innovation opportunities opportunity profitably satisfy stability strong success successful successfully tremendous win,22.70549964904785,22.81451988220215,23.036754608154297,22.1729793548584,22.30715751647949,22.67614936828613,22.41617774963379,44.0,33.0,11.0,0.0,4.455,26.49,0.48,1.46,0.97,2.27,1.65,1.1,0.49,-14.4,-15.38
33,ebay,2014-04-11,adverse adversely against allege breach breached breaches cease ceases closed closing closure concern contradict contradicts controversy criticism cut damage damages defeat delay delayed deny deprive destroy deter difficult disagree disagrees disclose disclosed disclosing disparage disparages dispute doubt erred erring error errors fail failed failure fined force forego harm ill illegal illegality impractical injunction injunctions injury inquiry irreparable lack late lie limitation litigation lose losing miss omission omissions oppose plea pleas poses posing precluding quit refuse reparation resign subpoena sue sued sues terminate threat threaten threatened unable unreasonably violation,ambiguities believe believed believes could depend dependent doubt exposure may nearly pending suggest,able accomplish accomplished beneficial beneficially benefit benefitting confident easily effective enable enabled enables enabling enhance enhanced exclusive exclusively gain gains good great greater greatly happy honor honored honoring invent invention leadership opportunity optimistic pleased satisfaction satisfy strong success successful tremendous valuable win,22.67614936828613,22.41617774963379,22.634218215942386,22.931926727294922,23.25898551940918,23.032560348510746,23.25898551940918,45.0,31.0,14.0,0.0,4.356,26.63,-1.15,-0.18,0.97,0.44,-0.97,1.43,0.0,-13.51,-12.66
34,ebay,2014-04-22,absence against concern confusion contested cut deter ill lack late lie miss plea pleas question questions quit resign resignation restate restatement revoke revoking termination,confusion could depend dependent may revise revised,able beneficial gain gains good highest satisfy win,23.032560348510746,23.25898551940918,23.036754608154297,22.52519989013672,21.67400360107422,22.49165344238281,22.869029998779297,45.0,31.0,14.0,0.0,4.356,26.63,0.98,0.02,-0.96,-0.15,3.77,1.53,5.51,-15.54,-14.12
35,ebay,2014-04-29,bad break closed closing closure collapse conciliation conciliations crisis cut delinquency deter difficult disclosing disrupt disruption divest divestiture divestitures downturn easing erred fined forego fraud ill impair impairment lapse late lie limitation limitations litigation lose losing loss losses lying miss missed poses quit restructuring sever taint,approximate approximately assume assumes assumption assumptions believe believes could depend dependent differ fluctuation fluctuations hidden intangible intangibles may nearly predict predicted recalculate revise revised risk risks uncertain uncertainties vary varying,able benefit easily effective enable enabled enables enhance enhancing exclusive gain gained gains good great greater improve improved improving profitably satisfy stability strong success successful successfully win,22.49165344238281,22.869029998779297,21.73270606994629,21.808181762695312,21.07439422607422,21.753671646118164,21.594335556030273,45.0,31.0,14.0,0.0,4.356,26.84,1.68,-3.37,-4.97,-0.25,3.22,-0.98,2.47,-18.95,-19.54
36,ebay,2014-05-22,break collapse concern cut cyberattack force fraud fraudulent ill inconvenience investigating lapse late lie lying miss serious seriously sue sued unauthorized,hidden may nearly,able best confident easily enable enabled enables encouraging enhance leading satisfy win,21.753671646118164,21.594335556030273,21.812376022338867,21.707550048828125,21.17083549499512,20.839582443237305,20.789264678955078,45.0,29.0,16.0,0.0,4.267,26.13,-0.73,0.27,1.01,-4.0,-1.56,-4.23,-1.8,-20.25,-20.44
37,ebay,2014-06-09,against break cut divest divestiture divestitures easing ill late lie litigation miss resign resignation resigned taint,assume assumes assumption assumptions believe could differ fluctuation fluctuations may nearly risk risks uncertain uncertainties vary varying,able best better easily easy effective enable enabled enables gain gains good great innovation leadership leading profitably satisfy stability strength strengthen strengthening strong success successful successfully win,20.839582443237305,20.789264678955078,20.231586456298828,20.361570358276367,20.82280921936035,20.571224212646484,20.82280921936035,45.0,29.0,16.0,0.0,4.267,25.99,-0.24,-2.92,-2.68,1.03,-1.21,2.27,0.0,-20.85,-19.88
38,ebay,2014-06-18,break cut ill lie miss,depend dependent,able satisfy win,20.571224212646484,20.82280921936035,20.797651290893555,20.709596633911133,20.998918533325195,21.309206008911133,21.25889015197754,44.0,29.0,15.0,0.0,4.295,25.99,1.22,1.1,-0.12,2.9,1.48,2.65,1.24,-18.01,-18.2
39,ebay,2014-07-16,bad break challenging closed closing closure collapse conciliation conciliations crisis cut cyberattack delinquency deter difficult disclosing disrupt disruption divest divestiture divestitures downturn easing erred fined forego fraud hamper hampered ill impair impairment lapse late lie limitation limitations litigation lose losing loss losses lying miss missed poses quit restructuring sever taint,approximate approximately assume assumes assumption assumptions believe believes could depend dependent differ fluctuation fluctuations hidden intangible intangibles may nearly predict predicted recalculate revise revised risk risks uncertain uncertainties vary varying,able benefit easily easy effective enable enabled enables enhance exclusive gain gained gains good improve improved improving profitably satisfy stability strong success successful successfully win,21.309206008911133,21.25889015197754,21.397260665893555,21.678197860717773,22.11846923828125,21.397260665893555,21.5859489440918,44.0,28.0,16.0,0.0,4.25,25.55,-0.24,0.41,0.65,-1.3,-3.26,-0.43,-2.41,-16.25,-15.51
40,ebay,2014-07-18,adverse adversely against allege alleged alleging arrears assertions bad bankrupt bankruptcies bankruptcy breach breaches break breakdown cancel canceled cancellation cancellations cancelled caution cautioned claims closed closing closings closure closures collapse complain complaint concern conciliation correcting costly counterfeit critical cut damage damages decline declines default defaults defend defendant defendants defending defer deficiency deficit delinquency depleting depletion deprecation deter deteriorate deviation difficult difficulties disclose disclosed discloses discontinue discontinued dispose disproportion disproportionate dispute disputes diversion divest divested divestiture divestitures doubt doubtful easing erred expose exposed fail failing failure false fault faults fined fines force forced forcing foreclosure foreclosures forfeit forfeited forfeiture forfeitures fraud harm ill illegal illegality impair impaired impairment impairments impractical improper inadequate ineffective infringe infringed infringement infringing injunction injunctions interfere interfered interfering intrusion investigation lack lacking lag lapse late lie limitation limitations litigate litigation lose loses losing loss losses lost lying miss misstate misstatement misstatements misuse negative negatively negligent negligently noncompliance opportunistic oppose opposed overage penalties plaintiff plaintiffs plea pleas pled poses posing prevention question questions quit reparation repossession repossessions restructuring restructurings sacrifice sacrifices sever severity subjecting sue sued sues suffer suffered suing susceptible taint terminate terminated terminating termination terminations threat threaten threatened unable unauthorized uncollectible underpayment undue unemployment unfavorable unfunded unqualified violate violated violating violation violations volatile volatility vulnerable weak weaken weakening weakness,anticipate anticipated apparent appear appearing appears approximate approximately approximates approximating assume assumed assuming assumption assumptions believe believed believes conditional contingencies contingent contingently could depend dependent depending depends deviation differ differing differs doubt doubtful exposure fluctuate fluctuating fluctuation fluctuations hidden indefinite indefinitely intangible intangibles likelihood may might pending possible predict preliminary probability probable revise revised risk risks sometime sometimes speculative uncertain uncertainties uncertainty unclear unobservable unusual variable variables varies vary volatile volatility,able achieve achieved achievement achieving adequately advances assure assured beneficial benefit best better desired effective efficiencies efficiency enable enables enhance favorable gain gained gains good great greater highest impress improve improved improvement improvements improving leading loyal meritorious opportunities positive positively progress resolve reward rewards satisfaction satisfied satisfy satisfying strength strengthen strengthening strong succeed succeeding success successful successfully win,21.397260665893555,21.5859489440918,21.678197860717773,22.08073234558105,22.311351776123047,22.11846923828125,22.193944931030273,44.0,28.0,16.0,0.0,4.25,25.21,0.88,1.31,0.43,0.17,-0.86,0.51,-0.53,-12.26,-11.96
