,ticker,date,neg_text,uncert_text,pos_text,price_prior,price_0,price_1,price_3,price_7
47,goog,2011-10-13,break conciliation conciliations cut erred erring fined ill investigation late lie limitation limitations miss plea pleas poses quit suing taint unforeseen,approximate approximately assumption assumptions believe believes could differ intangible may predict predicted risk risks uncertain uncertainties vary varying,able benefit effective gain gains great greater incredible opportunities satisfy strength strengthen strengthening superior transparency win,272.477783203125,277.6889038085937,293.92828369140625,293.3470458984375,296.282958984375
48,goog,2012-01-12,break closed closing cut ill interfere late lie lose losing miss plea pleas quit resign resigned,believe contingent may possible,able brilliant effective exciting great improving incredibly innovation innovations innovator leadership opportunity pleased satisfy win,310.95751953125,312.78564453125,310.47564697265625,312.2590637207031,290.8681945800781
49,goog,2012-01-19,break conciliation conciliations cut erred erring fined ill investigation late lie limitation limitations lying miss plea pleas poses quit suing taint unforeseen,approximate approximately assumption assumptions believe believes could differ intangible may predict predicted risk risks uncertain uncertainties vary varying,able benefit effective excited gain gains great greater opportunities satisfy strength strengthen strengthening strong superior transparency tremendous win,314.4100646972656,317.7185363769531,291.1016540527344,288.5880126953125,286.9784851074219
50,goog,2012-02-17,break closed cut disclose disclosed ill lie lose miss,approximate approximately assuming may,able beneficial beneficially gain gains satisfy win,301.3003234863281,300.36639404296875,305.01617431640625,302.0057373046875,307.1969909667969
51,goog,2012-04-12,break conciliation conciliations controversial critical crucial cut decline declines delay easing erred erring fined ill investigation late lie limitation limitations lying miss oppose opposed penalties plea pleas poses posing prevents question questions quit risky sacrifice sue sued sues suing taint terminate unable undermine unduly unforeseen urgency voiding,anticipate anticipated approximate approximately assumption assumptions believe believes could depend dependence dependent differ intangible may might possible predict predicted preliminary risk risks risky somewhat uncertain uncertainties unusual unusually vary varying,able benefit best better creativity dream easier effective enjoy enjoying excited exciting gain gains good great greater honor honored improve innovative opportunities opportunity progress satisfy stability strength strengthen strengthening strong success successful superior transparency tremendous win,315.9252014160156,323.4015808105469,310.28192138671875,302.81549072265625,296.869140625
52,goog,2012-04-13,break controversial critical crucial cut decline declines delay easing ill late lie miss oppose opposed plea pleas prevents quit risky sacrifice taint terminate undermine unduly urgency,assumption assumptions believe could depend dependence dependent differ may might possible preliminary risk risks risky somewhat uncertain uncertainties unusual unusually,able benefit best better creativity dream easier effective enjoy enjoying excited gain gains good great honor honored improve innovative opportunities progress satisfy stability strength strong success successful tremendous win,323.4015808105469,310.28192138671875,301.0767822265625,301.7623291015625,298.6922912597656
53,goog,2012-04-30,break cancel cancelled cut fined forego ill lie lying miss penalties quit terminate terminates termination,depend depending may pending variation variations,able effective satisfy win,305.50299072265625,300.4707336425781,300.2620849609375,303.5357971191406,302.6068420410156
54,goog,2012-05-22,absence adverse adversely against allegation allegations alleging antitrust assertions barrier barriers breach breached breaches break breaks cancel canceled cease challenge challenges claiming claims closed closing closure closures concern concerns conflict conflicting conflicts controversies corrupt corruption costly criminal critical curtail cut damage damaged damages decline defamation defect defective defects defend defending defer degrade delay delaying denial deny deter deterioration difficult difficulties diminish diminishing disaster disasters disclose discontinue discourage disproportion disproportionate dispute disputes disrupt disrupted disruption disruptions distract distraction diversion downward easing erred error errors excessive expose exposed exposes fail failing fails failure failures fines force forego fraud fraudulent fraudulently harm harmed harmful harming hazard hazardous hurt ill impair impairment impede impeded implicate inability inadequate inappropriate inappropriately inconsistent infringe infringement infringing injunction injunctions injury insufficient intentional interfere interference interrupt interrupted interruption interruptions invalid investigation investigations lack late lie limitation limitations litigate litigation lose losing loss losses lost lying malfeasance malfunction malfunctioning malfunctions miss negative negatively negligence omit omitted outage outages penalties plea pleas poses preventing prevents problem problems prolong prolonging purport quit recall recalls resign resignation risky sabotage scrutiny secrecy serious seriously sever severe severely shortage shortages slow slowed spam spammers stringent sue sued sues suffer suffered taint tense terminate terminated termination terminations threat threaten threatened unable unanticipated unauthorized unethical unfair unforeseen unfounded unlawful unwilling vandalism violate violates violation violations volatile volatility vulnerabilities vulnerable,anticipate anticipated anticipates anticipation approximate approximately assume assumed assuming believe believes contingent could depend depends differ exposure fluctuate fluctuation fluctuations may might nearly pending possibility possible predict predicted predicting risk risks risky sometime sometimes somewhat uncertain uncertainties uncertainty undesignated unidentified unknown unsettled variation variations varied vary varying volatile volatility,able achieve advantage advantages assure attractive beneficial beneficially benefit better confident creativity despite easily effective enable enhance enhanced enhancing enjoy enjoyable excitement exclusivity favorable gain gained gains good great greater happy improve improved innovate innovation innovations innovative invent invented leading meritorious opportunities pleased profitability resolve satisfy satisfying smooth strong succeed success successes successful successfully tremendous tremendously valuable win,305.07080078125,298.45880126953125,302.7608337402344,293.853759765625,288.5532531738281
55,goog,2012-06-26,absence against break cancel cancellation cancelled cancelling cease ceases claims closing closure conflict contrary cut defeat defeated defer deter discontinue discontinued dispose disqualifies disregard disregarding dissolution doubt erred fail fails force forego forfeit forfeited ill impair impairment incident interfere lapse lapsed late lie limitation limitations liquidation litigation losing loss lying miss plea pleas pled poses preclude quit restructuring restructurings revoke sever sue sued suing suspend suspended terminate terminated termination unpaid,clarification depend dependent depends doubt intangible may pending predict revise tending unusual,able achieve achievement benefit collaboration collaborations conclusive desirable effective efficiency exclusive exclusively favorable gain gains great greater improving innovation innovations invent inventor opportunities opportunity profitability resolve reward rewards satisfaction satisfies satisfy satisfying success win,278.53839111328125,280.5155029296875,282.8105773925781,288.1607971191406,296.0345764160156
56,goog,2012-07-19,break closing conciliation conciliations cut divest divestiture erred erring fined ill investigation late lie limitation limitations losing loss lying miss plea pleas poses quit sever suing taint unforeseen,approximate approximately assumption assumptions believe believes could differ hidden intangible intangibles may predict predicted risk risks uncertain uncertainties variability vary varying,able benefit effective excited exciting gain gains great greater invent inventor opportunities satisfy strength strengthen strengthening strong superior transparency win,288.5035705566406,294.61383056640625,303.4364318847656,301.8219299316406,314.1070251464844
57,goog,2012-08-13,break concern concerned cut deter difficult ill lag late lie lose lost miss negative restructuring sever taint,approximate approximately believe believes could differ may predict predicted risk risks uncertain uncertainties variability,able achieve great greater improve innovative profitability profitable satisfy success successful win,318.9256896972656,327.87249755859375,332.1695556640625,334.2609558105469,336.40203857421875
58,goog,2012-10-04,break cut ill late lie miss restructuring sever taint,approximate approximately could differ may predict predicted risk risks uncertain uncertainties,able improve profitability satisfy success successful win,378.7863464355469,381.5434265136719,381.3447265625,369.6408386230469,368.0958862304688
59,goog,2012-10-18,break conciliation conciliations cut divest divestiture erred erring fined ill investigation late lie limitation limitations loss lying miss plea pleas poses quit restructuring suing taint unforeseen,approximate approximately assumption assumptions believe believes could differ intangible intangibles may predict predicted risk risks uncertain uncertainties vary varying,able benefit effective gain gains great greater invent inventor opportunities satisfy strength strengthen strengthening superior transparency win,375.30401611328125,345.25445556640625,338.692138671875,337.9767761230469,336.6901550292969
60,goog,2012-10-18,break conciliation conciliations corrects cut divest divestiture erred erring erroneous erroneously fined ill investigation late lie limitation limitations loss lying miss plea pleas poses quit restructuring suing taint unforeseen,approximate approximately assumption assumptions believe believes could differ intangible intangibles may predict predicted risk risks uncertain uncertainties vary varying,able beautiful beautifully benefit effective excited gain gains great greater invent inventor opportunities progress satisfy strength strengthen strengthening strong superior transparency win,375.30401611328125,345.25445556640625,338.692138671875,337.9767761230469,336.6901550292969
61,goog,2012-12-20,break claims closing closure concern cut disclaim disclaims easing force ill late lie litigation lose losing miss quit sue sued taint,approximate approximately could differ may possible risk risks suggest suggested uncertain uncertainties uncertainty,able achieve advancement advancements benefit best better desired enable enhance improving innovating innovation innovations innovative innovator leading opportunities profitable satisfaction satisfy strength strengths strong success successful successfully vibrant win,357.72833251953125,358.8460388183594,355.5028076171875,352.4576110839844,351.4044494628906
62,goog,2012-12-21,break cut erred ill late lie miss sue sued,approximate approximately depend dependent,able beneficial beneficially satisfy win,358.8460388183594,355.5028076171875,352.4576110839844,352.1446533203125,347.7432556152344
63,goog,2013-01-03,absence against allege alleged allegedly anticompetitive antitrust arguing argument arguments breach breached breaching break cease challenge challenged challenges challenging claims closed closing closure complain complained concern concerned concerns conflict conflicts contend contends contested contradict contrary cut damage damages dampen defensive delay delays depriving deter disclose disclosed dismiss dismissal dismissed dispose dispute disputes dissolution doubt easing encumber encumbered enjoin enjoined erred fail fails fined force forced forcing forego harm harmed ill improper inability inconsistent infringe infringed infringement infringements infringing injunction injunctions injury interfere interference interrupt interruption investigation investigations lack lapse lapsed late lie limitation limitations litigation lose loses losing loss lost lying miss missed monopoly penalties plea pleas poses prejudice problem prosecute prosecuted question questions quit refusal refuse refused refuses refusing reject rejected relinquish relinquishes reparation revoke revoked scrutiny strain sue sued sues suing suspect suspend suspension terminate termination threat threaten threatened threatening threats unable unavailable undermining unfair unreasonable violate violated violates violation violations wasted,alteration alterations appear appearing assume assumed believe believed believes could depend dependent differ doubt may might pending possible reconsider revise risk tending,able accomplish achieving adequately benefit best better confident easier easily effective efficiency enable enabled enhance enhancement enhancements exceptional excited exclusive gain gaining gains good great honor improve improvement improvements innovate innovation integrity leading pleased resolve reward rewarded satisfied satisfies satisfy succeed success win,359.2881774902344,359.496826171875,366.6006164550781,364.28070068359375,359.2881774902344
64,goog,2013-01-22,bad break collapse conciliation conciliations cut discontinue discontinued dispose divest divestiture erred erring fined ill investigation lapse late lie limitation limitations lose loss lying miss plea pleas poses quit restructuring suing taint unforeseen,approximate approximately assumption assumptions believe believes could differ hidden intangible intangibles may predict predicted risk risks uncertain uncertainties vary varying,able achieve achievement benefit effective exciting gain gains great greater incredibly invent inventor opportunities satisfy strength strengthen strengthening strong superior transparency tremendous win,349.9787292480469,349.1640319824219,368.3542175292969,374.39990234375,375.4033508300781
65,goog,2013-02-08,break closed collapse cut disclose disclosed ill lapse lie lose miss sue sued,approximate approximately assuming may,able beneficial beneficially effective gain gains satisfy win,384.474365234375,390.1474609375,388.6820068359375,388.9005737304688,400.8180541992188
66,goog,2013-03-12,break collapse cut ill lapse lie miss,hidden,able satisfy win,414.71270751953125,411.1309814453125,409.9884338378906,404.51898193359375,403.0088195800781
67,goog,2013-04-18,break collapse conciliation conciliations cut discontinue discontinued erred erring fined ill lapse late lie limitation limitations loss lying miss plea pleas poses quit restructuring sue sued suing taint unforeseen,approximate approximately assumption assumptions believe believes could differ hidden intangible intangibles may predict predicted risk risks uncertain uncertainties vary varying,able benefit effective gain gains great greater improve invent inventor opportunities satisfy strength strengthen strengthening strong superior transparency win,388.7515563964844,380.4803466796875,397.3506164550781,401.33966064453125,406.88360595703125
68,goog,2013-06-11,against break collapse cut forego ill lapse lie miss,depend dependent hidden,able gain gains satisfy success win,442.23370361328125,437.06231689453125,433.1726379394531,434.6927490234375,439.5114135742188
69,goog,2013-06-17,break claims closure collapse concern cut defend defendant defendants deter disclose ill lapse lie litigation lose miss plaintiff plaintiffs quit sue termination unable,assumption depend dependent differ hidden may pending preliminary,able benefit best good opportunity satisfy win,434.6927490234375,440.26153564453125,447.4000854492188,439.5114135742188,434.0022277832031
70,goog,2013-07-18,break collapse conciliation conciliations cut discontinue discontinued divest divestiture erred erring fined ill lapse late lie limitation limitations loss lying miss plea pleas poses quit restructuring sue sued suing taint unforeseen,approximate approximately assumption assumptions believe believes could differ hidden intangible intangibles may predict predicted risk risks uncertain uncertainties vary varying,able benefit effective gain gains great greater improve invent inventor opportunities opportunity satisfy strength strengthen strengthening superior transparency tremendous win,456.3071594238281,452.3975830078125,445.403076171875,448.9798278808594,438.2843933105469
71,goog,2013-10-17,break closed closing closure collapse conciliation conciliations cut defer disclose disclosed discontinue discontinued divest divestiture erred erring fined ill lapse late lie limitation limitations lose losing loss lying miss plea pleas poses quit restructuring sue sued suing taint unforeseen,approximate approximately assuming assumption assumptions believe believes could differ hidden intangible intangibles may predict predicted risk risks uncertain uncertainties vary varying,able beautiful beneficial beneficially benefit effective gain gains great greater invent inventor opportunities progress satisfy strength strengthen strengthening strong superior transparency win,446.1134643554688,441.5233154296875,502.4371337890625,500.2463684082031,504.22052001953125
72,goog,2013-10-30,allegation allegations argument break claiming claims closed closure cut delay deter disclose disclosed dismiss dismissed dismissing fail failure fined force forego ill late lie limitation litigation lose miss missed negative plaintiff plaintiffs preclude prejudice prosecution quit sue sued suspect suspected unsuspected,assumption believe believed could depend dependent depending differ may might pending unknown,able benefit best effective gain gained good great greater opportunity positive satisfy success win,514.7719116210939,511.8807067871094,511.960205078125,509.7396240234375,504.7322082519531
73,goog,2014-01-13,break closing collapse cut ill lapse lie lose losing miss,,able best better dream easier excited great improving innovation innovations invent leadership positive satisfy tremendous win,561.4383544921875,557.8616333007811,570.9862670898438,574.374267578125,578.7457885742188
74,goog,2014-01-29,absence adverse antitrust break closing closure closures collapse cut defer erred force forego ill lapse late lie lose losing miss sue sued suing taint termination,anticipate anticipated anticipates approximate approximately believe believes could differ hidden risk risks uncertain uncertainties,able achieving benefit best confident easy efficient efficiently enable enjoy enjoys exceptional exceptionally gain great improving incredibly innovation innovations innovative invent invention opportunity satisfaction satisfy smooth smoothly strength strengthen strengthening strong success successful successfully tremendous win,557.8765258789061,549.883544921875,564.0265502929688,563.0528564453125,584.9157104492188
75,goog,2014-01-30,break closure collapse conciliation conciliations cut defer discontinue discontinued divest divestiture erred erring fined ill lapse late lie limitation limitations loss lying miss plea pleas poses quit restructuring sue sued suing taint unforeseen,approximate approximately assumption assumptions believe believes could differ hidden intangible intangibles may predict predicted risk risks uncertain uncertainties vary varying,able benefit effective excited gain gains great greater improve improvement improvements improving invent inventor opportunities progress satisfy strength strengthen strengthening superior transparency win,549.883544921875,564.0265502929688,586.6693115234375,565.402587890625,582.6752319335938
76,goog,2014-02-04,break closing collapse cut ill lapse late lie losing miss quit,hidden,able satisfy win,563.0528564453125,565.402587890625,567.9063110351562,584.9157104492188,596.0731201171875
77,goog,2014-02-25,adverse adversely against allege alleged arrears bankrupt bankruptcy breach break calamity cancel canceled cancellation cease ceases claims closed closing closure concern concerned conflict conflicted conflicts contrary crisis culpability cut damage damages default defaulting defect defects defend defending deter disclose disclosed dispose dispute disrupt disruption downgrading easing encumbrance encumbrances erred fail failed failure fault faulted faults fined force forced forego fraud fraudulent guilty harm ill impair impracticable inadvisable inappropriate incident inconsistent ineligible infringe infringement inquiry insolvency insufficient interfere investigate investigated investigating investigation investigations late lie limitation limitations liquidate lose losing loss losses mislead misleading misrepresent misrepresentation miss moratorium negative objecting objection omission omissions omit omits omitted overdue plaintiff plea plead pleaded pled poses postpone postponed purport quit refusal reparation revocation sever solvency sue sued sues suspend suspending suspension terminate terminated termination terminations threat threaten threatened threatening unable unavailable unfavorable unpaid violation,alteration appear appeared appearing assume assumed assuming assumption assumptions believe believes conditional could depend dependent differ differing indeterminate may might nonassessable ordinarily pending possible preliminary tending vary,able benefit best confident effective enabling exclusive favorable gain gained gains good great greater highest invent invention inventions leading opportunity satisfaction satisfactory satisfied satisfy stable succeed succeeding success win,602.33740234375,606.0581665039062,606.1426391601562,603.897216796875,605.8644409179688
78,goog,2014-03-10,break collapse cut ill lapse lie miss,hidden,able satisfy win,603.4700317382812,601.8704223632812,596.1177978515625,590.6881713867188,595.750244140625
79,goog,2014-03-26,absence adverse adversely against breach breached breaches break burden cease ceases ceasing closed closure conflict contrary cut damage damaged delay deter disclose disclosed disfavor disfavoring doubt easing erred erring error fail failure fined force forced forego ill illegal illegality impending inconvenient injunction injunctions invalid invalidity involuntary irreparably late lie limitation litigation lose miss objection opposition plaintiff plaintiffs poses preclude purport purported question quit restate restatement sue sued terminate terminated terminates termination violation,ambiguity conditional conditionally depend dependent differ doubt may nonassessable pending presumption,able beneficial beneficially benefit conclusive desirable effective exclusive favoring gain gains good great greater opportunity positive satisfied satisfy success valuable win,575.6161499023438,562.3275756835939,555.4060668945311,553.9242553710939,540.1698608398439
80,goog,2014-04-16,break collapse conciliation conciliations cut defer discontinue discontinued dispose erred erring fined ill lapse late lie limitation limitations loss lying miss plea pleas poses quit restate restated sue sued suing taint unforeseen,approximate approximately assumption assumptions believe believes could differ hidden intangible intangibles may predict predicted risk risks uncertain uncertainties vary varying,able benefit effective excited gain gains great greater improve improvement improvements invent inventor opportunities progress satisfy strength strengthen strengthening superior transparency win,533.5064697265625,553.49658203125,533.1683349609375,525.729248046875,513.3572998046875
81,goog,2014-05-15,against break closed cut disclose disclosed forego ill lie lose miss,depend dependent,able gain gains satisfy success win,523.77001953125,517.1365356445311,517.782958984375,526.8729858398439,542.079345703125
82,goog,2014-07-15,break closed closing collapse cut ill interfere lapse late lie lose losing miss plea pleas quit resign resigned,believe contingent hidden may possible,able effective enhancing honor honored improving innovation innovations leadership pleased satisfy win,581.671630859375,581.5821533203125,579.4737548828125,591.8258056640625,590.1052856445312
83,goog,2014-07-17,break collapse conciliation conciliations cut defer discontinue discontinued dispose divest divestiture erred erring fined ill lapse late lie limitation limitations loss lying miss plea pleas poses quit restate restated sue sued suing taint unforeseen,almost approximate approximately assumption assumptions believe believes could differ hidden intangible intangibles may predict predicted risk risks uncertain uncertainties vary varying,able benefit effective excited gain gains great greater invent inventor opportunities satisfy strength strengthen strengthening superior transparency win,579.4737548828125,570.5925903320312,591.8258056640625,591.4876708984375,587.3703002929688
84,goog,2014-10-16,bad break collapse conciliation conciliations cut defer discontinue discontinued dispose divest divestiture erred erring fined ill impair impairment lapse late lie limitation limitations loss lying miss plea pleas poses quit restate restated sue sued suing taint unforeseen,approximate approximately assumption assumptions believe believes could differ hidden intangible intangibles may predict predicted risk risks uncertain uncertainties vary varying,able benefit effective excited gain gains great greater invent inventor opportunities satisfy strength strengthen strengthening strong superior transparency win,527.1315307617189,521.6417236328125,508.3746948242188,523.66064453125,537.8128051757811
