,ticker,date,neg_text,uncert_text,pos_text,price_prior,price_0,price_1,price_3,price_7
85,goog,2014-11-17,abuse abuses against allegation allegations allege alleged allegedly alleging argue argued argument bankrupt bankruptcy barred breach breached break cancel canceled cancellation cancelled challenge challenges claims closure closures collapse complain complaint concealed concern contend contention contentions contested contradict convict convicted counterclaim criminal cut damage damages danger dangerous defect defective defend defendant defendants delay delays denied deny denying deter difficult difficulties dismiss dismissal dismissed dismissing dispute disputes disrupt disrupting easing egregious enjoin enjoined erred erring evade evasion fail failed fails failure failures fault felony fined force forced forcing forego frustrate frustrating harm harmed ill illegal impair improper improperly inaccurate incident intentional investigate investigation lapse late lie limitation litigation lose lying malice miss missed negligent objecting objection objections omission omissions opposing opposition overturn overturned plaintiff plaintiffs plea plead pleaded poses posing preclude prejudice prevention problem problems prosecute prosecuting prosecution purport purported question questions quit refuse refused relinquish relinquished sever sue sued suffer suffered suspect suspected taint terminate terminated termination testify threat unjust unlicensed unreasonably unsuspected violate violated violation violations wrong wrongdoing wrongful,appear appeared approximate approximately assume assumes believe believed believes contingent could depend dependent differ hidden may might pending possible preliminarily preliminary presumption reconsider risk risks uncertain uncertainty unknown,able accomplish achieve achieved adequately beneficial benefit best better collaborating confident desirable despite effective gain gained gains good improve loyal opportunity proactive proactively progress resolve satisfy success successes successful win,541.4229736328125,533.5761108398439,532.1041870117189,531.9052734375,537.4149780273439
86,goog,2015-01-29,break closed collapse conciliation conciliations cut discontinue discontinued divest divestiture erred erring fined ill impair impairment lapse late lie limitation limitations lose loss lying miss plea pleas poses quit restate restated sue sued suing taint unforeseen,approximate approximately assumption assumptions believe believes could differ hidden intangible intangibles may predict predicted risk risks uncertain uncertainties vary varying,able benefit despite effective gain gains great greater invent inventor opportunities satisfy strength strengthen strengthening strong superior transparency win,507.20880126953125,507.8652038574219,531.5946044921875,526.343505859375,524.9412231445311
87,goog,2015-02-13,break closed collapse concern concerns cut disclose disclosed ill lapse lie lose miss,approximate approximately assuming hidden,able satisfy win,539.9585571289061,546.0053100585939,539.8690795898439,536.7462768554689,533.156005859375
88,goog,2015-03-10,break cut deter ill lie miss,,able effective satisfy win,565.7366943359375,551.9724731445311,548.1634521484375,544.3245849609375,554.9361572265625
89,goog,2015-03-23,break collapse cut ill lapse late lie litigation miss plea pleas,hidden,able satisfy win,557.293212890625,555.7516479492189,567.0693969726562,552.131591796875,539.590576171875
90,goog,2015-03-24,break crisis cut ill lack lacks lie miss sever,differ,able better creative delight delighted distinction effective improve innovate opportunity satisfy strong success successful tremendous tremendously win,555.7516479492189,567.0693969726562,555.726806640625,545.3389892578125,532.5990600585939
91,goog,2015-03-26,against break closed closing closure closures collapse concern concerns contrary cut defer deter disclose dispute disputes doubt ill lapse late lie lose losing miss plea pleas purport question questions quit sue sued terminate terminated terminates,contingent could doubt hidden may,able benefit confident effective gain gains pleased satisfactory satisfy smooth win,555.726806640625,552.131591796875,545.3389892578125,545.0008544921875,533.8273315429689
92,goog,2015-04-23,break collapse conciliation conciliations cut deter discontinue discontinued erred erring fined ill impair impairment lapse late lie limitation limitations litigation lose loss lying miss plea pleas poses quit sue sued suing taint unforeseen volatility,assumption assumptions believe believes contingencies could differ fluctuation fluctuations hidden intangible intangibles may predict predicted risk risks uncertain uncertainties vary varying volatility,able benefit gain gains great greater opportunities satisfy strength strengthen strengthening superior transparency win,536.4130859375,544.0062866210939,561.9674682617189,553.6799926757811,540.780029296875
93,goog,2015-06-04,absence against break cancel cancellation cancelled cancelling cease ceases claims closing conflict contrary cut defer deter discontinue discontinued dispose disqualifies disregard disregarding dissolution doubt erred fail fails forego forfeit forfeited ill impair impairment incident interfere lapse lapsed late lie limitation limitations liquidation litigation losing loss lying miss pled poses preclude quit restructuring restructurings revoke sue sued suing suspend suspended terminate terminated termination unpaid,clarification depend dependent depends doubt intangible may pending revise risk tending unusual,able achieve achievement collaboration collaborations conclusive desirable effective efficiency exclusive exclusively gain gains great greater innovation invent inventor opportunities opportunity profitability reward rewards satisfaction satisfies satisfy satisfying success win,540.3099975585939,536.7000122070311,533.3300170898439,526.6900024414061,527.2000122070311
94,goog,2015-07-16,break collapse conciliation conciliations cut deter discontinue discontinued erred erring fined ill impair impairment incorrect lapse late lie limitation limitations litigation loss lying miss plea pleas poses quit sue sued suing taint volatility,approximate approximately assumption assumptions believe believes contingencies could differ fluctuation fluctuations hidden intangible intangibles may predict predicted revise revised risk risks uncertain uncertainties vary varying volatility,able benefit gain gains great greater opportunities satisfy strength strengthen strengthening strong superior transparency win,560.219970703125,579.8499755859375,672.9299926757812,662.2999877929688,627.260009765625
95,goog,2015-08-10,break closure collapse cut deter fined ill lapse late lie limitation limitations litigation loss miss poses quit restate restated serious seriously stopped sue sued taint worry,anticipate anticipated anticipates believe believed could depend dependence dependent differ hidden might pending risk risks sometime sometimes speculative tending uncertain uncertainties,able better enjoy enjoying excited exciting gain great greater improving incredible innovation innovations opportunities progress prospering satisfy strong transparency tremendous tremendously win,635.2999877929688,633.72998046875,660.780029296875,656.4500122070312,660.9000244140625
96,goog,2015-09-11,break cancel cancellation collapse cut ill lapse lie miss quit,hidden,able satisfy smooth win,621.3499755859375,625.77001953125,623.239990234375,635.97998046875,622.6900024414062
97,goog,2015-10-02,against break cancel canceled cancelled cease claiming claims conflict conflicts cut delist destroy destroyed deter erred fined force forego forfeit ill interrupt interrupted invalid invalidity late lie limitation limitations lose loss lost lying miss pled poses purport quit relinquish resign resignation sever stolen sue sued suspend suspended terminate terminated termination unfunded unrest,assume assumed assumption may might nonassessable tending,able best desirable effective gain gains good great greater perfect resolve satisfactory satisfy success valuable win,611.2899780273438,626.9099731445312,641.469970703125,642.3599853515625,652.2999877929688
98,goog,2015-10-22,break closing collapse conciliation conciliations cut deter disclosing discontinue discontinued erred erring fined ill impair impairment incorrect lapse late lie limitation limitations losing loss lying miss plea pleas poses quit sue sued suing taint volatility,assumption assumptions believe believes contingencies could differ fluctuation fluctuations hidden intangible intangibles may predict predicted revise revised risk risks uncertain uncertainties vary varying volatility,able benefit effective excited gain gains great greater opportunities satisfy strength strengthen strengthening success superior transparency win,642.6099853515625,651.7899780273438,702.0,708.489990234375,721.1099853515625
99,goog,2015-11-19,break closing collapse cut ill lapse lie lose losing miss resign sue sued,depend dependent hidden possible,able advantage benefit best better easy efficient efficiently excited great revolutionizing satisfy win,740.0,738.4099731445312,756.5999755859375,748.280029296875,742.5999755859375
